pmid,Title,Abstract,Author,Year,Volume,Issue,Journal,Citation,Link
40057660,Endophthalmitis caused by Enterococcus faecalis: cytological and bacteriological diagnosis using vitreous fluid.,"BACKGROUND: This case report aims to describe the diagnostic method and the clinical course of endophthalmitis caused by Enterococcus faecalis.
CASE PRESENTATION: A 66-year-old man presented with sudden, severe pain and acute vision loss in his left eye. Ocular examination revealed significant intraocular inflammation and dense vitritis, suggesting endogenous endophthalmitis. Systemic evaluation identified colonic diverticulosis as a potential source of infection. Pars plana vitrectomy was performed, and analysis of the vitreous fluid, including cytological and bacteriological studies, confirmed the presence of Enterococcus faecalis.
CONCLUSION: The vitreous fluid is an adequate sample for characterizing endophthalmitis by combining cytological and bacteriological analyses.","Ramtohul P, Frankel D, Gouriet F, Delaporte C, David T, Roll P, Kaspi E",2025,15,1,J Ophthalmic Inflamm Infect,"Ramtohul P, et al. Endophthalmitis caused by Enterococcus faecalis: cytological and bacteriological diagnosis using vitreous fluid. Endophthalmitis caused by Enterococcus faecalis: cytological and bacteriological diagnosis using vitreous fluid. 2025; 15:22. doi: 10.1186/s12348-025-00482-w",https://ncbi.nlm.nih.gov/pubmed/40057660
40057009,Associations between Ambient Air Pollution and Five Common Vision-threatening Ocular Diseases in Middle-aged and Older Adults: A Large Prospective Cohort Study.,"PURPOSE: Ambient air pollution may exacerbate ocular conditions; however, comprehensive research on the effects of various pollutants remains limited. To evaluate the association between multiple air pollutants and the incidence of five common vision-threatening ocular diseases: cataracts, glaucoma, macular degeneration, diabetic retinopathy, and retinal detachment.
DESIGN: Prospective cohort study METHODS: We included 114,930 participants with refractometry at baseline in this prospective cohort study based on data from the UK Biobank. Annual average concentrations of nitrogen oxides (NO<sub>x</sub>), nitrogen dioxide (NO<sub>2</sub>), and particulate matter (PM) with diameters &lt; 2.5 (PM<sub>2.5</sub>) and &lt; 10 μm (PM<sub>10</sub>) were assessed using land use regression models. Restricted cubic spline models and Cox proportional hazards regression were used to estimate the association between air pollution exposure and ocular disease incidence, with stratified analyses based on myopia status.
RESULTS: An interquartile range increase in PM<sub>10</sub> and NO<sub>x</sub> was significantly associated with a higher risk of diabetic retinopathy among participants with myopia, with hazard ratios (HRs) of 1.11 (95% confidence interval [CI]: 1.01-1.23) and 1.22 (95% CI: 1.02-1.45), respectively. PM<sub>10</sub> was linked to 9% increase in retinal detachment incidence in the myopic population and PM<sub>2.5</sub> was linked to 8% increase in glaucoma incidence in the nonmyopic population. High PM<sub>10</sub> exposure was associated with a 61% higher risk of diabetic retinopathy in the myopic group. Further stratified analysis revealed that the impact of PM<sub>10</sub> on diabetic retinopathy was more pronounced in individuals with low-to-moderate myopia than in those with high myopia. High PM<sub>10</sub> exposure also correlated with a 67% higher risk of retinal detachment and a 44% higher risk of macular degeneration in the low-to-moderate myopic population.
CONCLUSIONS: Exposure to high levels of PM<sub>10</sub> was associated with an increased risk of diabetic retinopathy and retinal detachment, highlighting the importance of addressing air pollutants as an intervention for vision-threatening ocular diseases.","Wang Z, Yu Y, Ye Y, Wang L, Bao Y, Wang X, Zhou X, Zhao J",2025,N/A,N/A,Am J Ophthalmol,"Wang Z, et al. Associations between Ambient Air Pollution and Five Common Vision-threatening Ocular Diseases in Middle-aged and Older Adults: A Large Prospective Cohort Study. Associations between Ambient Air Pollution and Five Common Vision-threatening Ocular Diseases in Middle-aged and Older Adults: A Large Prospective Cohort Study. 2025; (unknown volume):(unknown pages). doi: 10.1016/j.ajo.2025.03.009",https://ncbi.nlm.nih.gov/pubmed/40057009
40056051,Evidence on the Use of Topical Ciclosporin for Ocular Surface Disease: A Systematic Review and Meta-Analysis.,"BACKGROUND: To identify evidence on the use of topical CsA for ocular surface diseases (OSD).
METHODS: A literature search was conducted following the preferred reporting items for systematic reviews and meta-analyses (PRISMA) through June 2023 via Cochrane Central Registries, Clinical Trials Registry, Grey literature and citation searching. Randomised clinical trials (RCTs) in which different concentrations of topical CsA were compared with one another or other topical therapies were included. Risk of bias was assessed following the Cochrane ROB2 standard tool. Meta-analysis was considered when data were sufficient. The certainty of evidence was assessed using the Grading of Recommendations, Assessment, Development and Evaluations (GRADE).
RESULTS: Five hundred and eight-three RCT publication titles were identified, of which 48 OSD RCTs were included. Thirty trials found significantly better efficacy with CsA irrespective of dose or concentration for OSD. The effect of CsA was comparable to artificial tears (AT), vehicle, fluorometholone 0.1%, tacrolimus 0.03% or diquafosol 3% only in 13 trials. Improved outcomes with CsA for symptoms (RCTs comprising 1107-patients) and clinical signs, including in ocular surface staining (2505-patients) and the average number of goblet cells (138-patients) were found. Inconsistency of treatment effect on symptoms and signs, particularly tear film function, was evident in some trials. Ten trials were judged to be at high risk of bias. The certainty of evidence was judged to be low to moderate, downgraded mostly for imprecision and risk of bias.
CONCLUSIONS: Topical CsA treatment effect on ocular surface symptoms and staining suggests that CsA may be superior to the vehicle, AT or other topical treatment alternatives for OSD.","Chidi-Egboka NC, Fan L, Qureshi M, Samarawickrama C, Stapleton F, Trinh T, Markoulli M, Chan E, Chen JY, Holland J, Watson SL",2025,N/A,N/A,Clin Exp Ophthalmol,"Chidi-Egboka NC, et al. Evidence on the Use of Topical Ciclosporin for Ocular Surface Disease: A Systematic Review and Meta-Analysis. Evidence on the Use of Topical Ciclosporin for Ocular Surface Disease: A Systematic Review and Meta-Analysis. 2025; (unknown volume):(unknown pages). doi: 10.1111/ceo.14514",https://ncbi.nlm.nih.gov/pubmed/40056051
40055942,Computer vision syndrome: a comprehensive literature review.,"Computer Vision Syndrome is a growing health concern in the digital age, with a reported prevalence of 69.0%. It is caused by screen-related, environmental, ergonomic, and physiological factors, affecting diverse demographics. The COVID-19 pandemic significantly amplified CVS due to increased screen time for remote work, online learning, and social media use, with studies reporting symptoms in up to 74% of individuals. Unique visual challenges from digital screens, including reduced clarity and glare, exacerbate symptoms like dry eyes and discomfort, especially in those with uncorrected vision. Understanding CVS is crucial for mitigating its impact through effective prevention and management strategies. This study explores the causes, diagnosis, management, and prevention strategies of CVS by synthesizing recent findings from optometry, occupational health, digital health, and ergonomics. It also highlights emerging trends such as AI, wearables, and augmented reality while providing practical management strategies. A narrative review of literature from 2014 to 2024 was conducted, focusing on PubMed-indexed, peer-reviewed articles, including meta-analyses and systematic reviews, with priority given to recent, highly cited studies.","Kahal F, Al Darra A, Torbey A",2025,11,1,Future Sci OA,"Kahal F, et al. Computer vision syndrome: a comprehensive literature review. Computer vision syndrome: a comprehensive literature review. 2025; 11:2476923. doi: 10.1080/20565623.2025.2476923",https://ncbi.nlm.nih.gov/pubmed/40055942
40054778,Ocular manifestations secondary to cocaine abuse - A reviewRunning head: Ocular Complications of Cocaine Abuse.,"Cocaine, a prevalent drug of abuse, is associated with numerous systemic health complications, including significant ocular manifestations. These ocular effects range from mild to severe, with the potential for irreversible vision loss. Despite the extensive documentation of cocaine's systemic effects, the literature still lacks a focused review of its ocular manifestations. We methodically explores the epidemiology, pathophysiology, clinical presentations, diagnostic challenges, and therapeutic approaches related to cocaine-associated ocular manifestations. By categorizing the findings based on the anatomical location and type of pathology-orbital, corneal, retinal, neuro-ophthalmic, glaucoma-related, and uveal manifestations-we aim to provide a detailed overview that aids in early diagnosis and effective management of ocular disease secondary to cocaine use. Our review highlights the importance of awareness among clinicians, showcasing the wide range of ocular pathology to improve patient outcomes and prevent long-term ocular damage after cocaine abuse.","Rickels KL, Ghaleb R, Elhusseiny AM, Chauhan MZ, Toma J, Wang T, Cheng D, Ali A, Sallam AB",2025,N/A,N/A,Surv Ophthalmol,"Rickels KL, et al. Ocular manifestations secondary to cocaine abuse - A reviewRunning head: Ocular Complications of Cocaine Abuse. Ocular manifestations secondary to cocaine abuse - A reviewRunning head: Ocular Complications of Cocaine Abuse. 2025; (unknown volume):(unknown pages). doi: 10.1016/j.survophthal.2025.02.004",https://ncbi.nlm.nih.gov/pubmed/40054778
